{
  "$schema": "https://json-schema.org/draft/2020-12/schema",
  "title": "CaptionsChunkV3_4",
  "type": "array",
  "items": {
    "type": "object",
    "required": ["id", "text", "startFrame", "endFrame", "box", "words"],
    "properties": {
      "id": { "type": "string" },
      "text": { "type": "string" },
      "startFrame": { "type": "integer" },
      "endFrame": { "type": "integer" },
      "box": {
        "type": "object",
        "required": ["x", "y", "width", "height"],
        "properties": {
          "x": { "type": "number", "default": 80 },
          "y": { "type": "number", "minimum": 1420, "maximum": 1550 },
          "width": { "type": "number", "default": 920 },
          "height": { "type": "number", "maximum": 200 }
        }
      },
      "words": {
        "type": "array",
        "items": {
          "type": "object",
          "required": ["word", "startFrame", "endFrame"],
          "properties": {
            "word": { "type": "string" },
            "startFrame": { "type": "integer" },
            "endFrame": { "type": "integer" }
          }
        }
      }
    }
  }
}
