[
  {
    "id": "cap_1_a",
    "text": "Chỉ một sai sót đơn lẻ trong hàng tỷ ký tự mã di truyền DNA có thể",
    "startFrame": 0,
    "endFrame": 108,
    "box": {
      "x": 80,
      "y": 1470,
      "width": 920,
      "height": 170
    },
    "words": [
      {
        "word": "Chỉ",
        "startFrame": 0,
        "endFrame": 6
      },
      {
        "word": "một",
        "startFrame": 6,
        "endFrame": 13
      },
      {
        "word": "sai",
        "startFrame": 13,
        "endFrame": 19
      },
      {
        "word": "sót",
        "startFrame": 19,
        "endFrame": 25
      },
      {
        "word": "đơn",
        "startFrame": 25,
        "endFrame": 32
      },
      {
        "word": "lẻ",
        "startFrame": 32,
        "endFrame": 38
      },
      {
        "word": "trong",
        "startFrame": 38,
        "endFrame": 44
      },
      {
        "word": "hàng",
        "startFrame": 44,
        "endFrame": 51
      },
      {
        "word": "tỷ",
        "startFrame": 51,
        "endFrame": 57
      },
      {
        "word": "ký",
        "startFrame": 57,
        "endFrame": 63
      },
      {
        "word": "tự",
        "startFrame": 63,
        "endFrame": 70
      },
      {
        "word": "mã",
        "startFrame": 70,
        "endFrame": 76
      },
      {
        "word": "di",
        "startFrame": 76,
        "endFrame": 82
      },
      {
        "word": "truyền",
        "startFrame": 82,
        "endFrame": 89
      },
      {
        "word": "DNA",
        "startFrame": 89,
        "endFrame": 95
      },
      {
        "word": "có",
        "startFrame": 95,
        "endFrame": 101
      },
      {
        "word": "thể",
        "startFrame": 101,
        "endFrame": 108
      }
    ]
  },
  {
    "id": "cap_1_b",
    "text": "gây ra những căn bệnh hiểm nghèo như thiếu máu hồng cầu hình liềm hay ung thư.",
    "startFrame": 108,
    "endFrame": 215,
    "box": {
      "x": 80,
      "y": 1470,
      "width": 920,
      "height": 170
    },
    "words": [
      {
        "word": "gây",
        "startFrame": 108,
        "endFrame": 114
      },
      {
        "word": "ra",
        "startFrame": 114,
        "endFrame": 120
      },
      {
        "word": "những",
        "startFrame": 120,
        "endFrame": 127
      },
      {
        "word": "căn",
        "startFrame": 127,
        "endFrame": 133
      },
      {
        "word": "bệnh",
        "startFrame": 133,
        "endFrame": 139
      },
      {
        "word": "hiểm",
        "startFrame": 139,
        "endFrame": 146
      },
      {
        "word": "nghèo",
        "startFrame": 146,
        "endFrame": 152
      },
      {
        "word": "như",
        "startFrame": 152,
        "endFrame": 158
      },
      {
        "word": "thiếu",
        "startFrame": 158,
        "endFrame": 165
      },
      {
        "word": "máu",
        "startFrame": 165,
        "endFrame": 171
      },
      {
        "word": "hồng",
        "startFrame": 171,
        "endFrame": 177
      },
      {
        "word": "cầu",
        "startFrame": 177,
        "endFrame": 184
      },
      {
        "word": "hình",
        "startFrame": 184,
        "endFrame": 190
      },
      {
        "word": "liềm",
        "startFrame": 190,
        "endFrame": 196
      },
      {
        "word": "hay",
        "startFrame": 196,
        "endFrame": 203
      },
      {
        "word": "ung",
        "startFrame": 203,
        "endFrame": 209
      },
      {
        "word": "thư.",
        "startFrame": 209,
        "endFrame": 215
      }
    ]
  },
  {
    "id": "cap_2_a",
    "text": "Thế nhưng các công cụ chỉnh sửa truyền thống như ZFN hay TALEN lại quá cồng kềnh,",
    "startFrame": 226,
    "endFrame": 347,
    "box": {
      "x": 80,
      "y": 1470,
      "width": 920,
      "height": 170
    },
    "words": [
      {
        "word": "Thế",
        "startFrame": 226,
        "endFrame": 233
      },
      {
        "word": "nhưng",
        "startFrame": 233,
        "endFrame": 240
      },
      {
        "word": "các",
        "startFrame": 240,
        "endFrame": 247
      },
      {
        "word": "công",
        "startFrame": 247,
        "endFrame": 254
      },
      {
        "word": "cụ",
        "startFrame": 254,
        "endFrame": 261
      },
      {
        "word": "chỉnh",
        "startFrame": 261,
        "endFrame": 268
      },
      {
        "word": "sửa",
        "startFrame": 268,
        "endFrame": 275
      },
      {
        "word": "truyền",
        "startFrame": 275,
        "endFrame": 283
      },
      {
        "word": "thống",
        "startFrame": 283,
        "endFrame": 290
      },
      {
        "word": "như",
        "startFrame": 290,
        "endFrame": 297
      },
      {
        "word": "ZFN",
        "startFrame": 297,
        "endFrame": 304
      },
      {
        "word": "hay",
        "startFrame": 304,
        "endFrame": 311
      },
      {
        "word": "TALEN",
        "startFrame": 311,
        "endFrame": 318
      },
      {
        "word": "lại",
        "startFrame": 318,
        "endFrame": 325
      },
      {
        "word": "quá",
        "startFrame": 325,
        "endFrame": 332
      },
      {
        "word": "cồng",
        "startFrame": 332,
        "endFrame": 339
      },
      {
        "word": "kềnh,",
        "startFrame": 339,
        "endFrame": 347
      }
    ]
  },
  {
    "id": "cap_2_b",
    "text": "chi phí đắt đỏ và nguy cơ cắt chệch mục tiêu rất cao.",
    "startFrame": 347,
    "endFrame": 439,
    "box": {
      "x": 80,
      "y": 1470,
      "width": 920,
      "height": 170
    },
    "words": [
      {
        "word": "chi",
        "startFrame": 347,
        "endFrame": 354
      },
      {
        "word": "phí",
        "startFrame": 354,
        "endFrame": 361
      },
      {
        "word": "đắt",
        "startFrame": 361,
        "endFrame": 368
      },
      {
        "word": "đỏ",
        "startFrame": 368,
        "endFrame": 375
      },
      {
        "word": "và",
        "startFrame": 375,
        "endFrame": 382
      },
      {
        "word": "nguy",
        "startFrame": 382,
        "endFrame": 389
      },
      {
        "word": "cơ",
        "startFrame": 389,
        "endFrame": 396
      },
      {
        "word": "cắt",
        "startFrame": 396,
        "endFrame": 403
      },
      {
        "word": "chệch",
        "startFrame": 403,
        "endFrame": 410
      },
      {
        "word": "mục",
        "startFrame": 410,
        "endFrame": 418
      },
      {
        "word": "tiêu",
        "startFrame": 418,
        "endFrame": 425
      },
      {
        "word": "rất",
        "startFrame": 425,
        "endFrame": 432
      },
      {
        "word": "cao.",
        "startFrame": 432,
        "endFrame": 439
      }
    ]
  },
  {
    "id": "cap_3_a",
    "text": "Trong tự nhiên, vi khuẩn đã phát triển một hệ thống miễn dịch tinh vi mang tên CRISPR,",
    "startFrame": 448,
    "endFrame": 583,
    "box": {
      "x": 80,
      "y": 1470,
      "width": 920,
      "height": 170
    },
    "words": [
      {
        "word": "Trong",
        "startFrame": 448,
        "endFrame": 455
      },
      {
        "word": "tự",
        "startFrame": 455,
        "endFrame": 463
      },
      {
        "word": "nhiên,",
        "startFrame": 463,
        "endFrame": 470
      },
      {
        "word": "vi",
        "startFrame": 470,
        "endFrame": 478
      },
      {
        "word": "khuẩn",
        "startFrame": 478,
        "endFrame": 485
      },
      {
        "word": "đã",
        "startFrame": 485,
        "endFrame": 493
      },
      {
        "word": "phát",
        "startFrame": 493,
        "endFrame": 500
      },
      {
        "word": "triển",
        "startFrame": 500,
        "endFrame": 508
      },
      {
        "word": "một",
        "startFrame": 508,
        "endFrame": 515
      },
      {
        "word": "hệ",
        "startFrame": 515,
        "endFrame": 523
      },
      {
        "word": "thống",
        "startFrame": 523,
        "endFrame": 530
      },
      {
        "word": "miễn",
        "startFrame": 530,
        "endFrame": 538
      },
      {
        "word": "dịch",
        "startFrame": 538,
        "endFrame": 545
      },
      {
        "word": "tinh",
        "startFrame": 545,
        "endFrame": 553
      },
      {
        "word": "vi",
        "startFrame": 553,
        "endFrame": 560
      },
      {
        "word": "mang",
        "startFrame": 560,
        "endFrame": 568
      },
      {
        "word": "tên",
        "startFrame": 568,
        "endFrame": 575
      },
      {
        "word": "CRISPR,",
        "startFrame": 575,
        "endFrame": 583
      }
    ]
  },
  {
    "id": "cap_3_b",
    "text": "giúp ghi nhớ các đoạn mã của virus để tiêu diệt chúng khi tái xâm nhập.",
    "startFrame": 583,
    "endFrame": 703,
    "box": {
      "x": 80,
      "y": 1470,
      "width": 920,
      "height": 170
    },
    "words": [
      {
        "word": "giúp",
        "startFrame": 583,
        "endFrame": 590
      },
      {
        "word": "ghi",
        "startFrame": 590,
        "endFrame": 598
      },
      {
        "word": "nhớ",
        "startFrame": 598,
        "endFrame": 605
      },
      {
        "word": "các",
        "startFrame": 605,
        "endFrame": 613
      },
      {
        "word": "đoạn",
        "startFrame": 613,
        "endFrame": 620
      },
      {
        "word": "mã",
        "startFrame": 620,
        "endFrame": 628
      },
      {
        "word": "của",
        "startFrame": 628,
        "endFrame": 635
      },
      {
        "word": "virus",
        "startFrame": 635,
        "endFrame": 643
      },
      {
        "word": "để",
        "startFrame": 643,
        "endFrame": 650
      },
      {
        "word": "tiêu",
        "startFrame": 650,